{
  "schema_version": "1.0",
  "message_type": "worker_dry_run",
  "created_at": "2026-07-18T10:04:00Z",
  "safety_flags": {
    "synthetic_local_only": true,
    "mock_only": true,
    "dry_run": true,
    "owner_review_required": true,
    "external_side_effects_allowed": false,
    "external_side_effects_occurred": false,
    "blackboard_write_allowed": false,
    "queue_write_allowed": false,
    "audit_trail_write_allowed": false,
    "worker_dispatch_allowed": false,
    "openclaw_call_allowed": false,
    "hermes_runtime_allowed": false,
    "connector_call_allowed": false,
    "google_sheets_write_allowed": false,
    "follow_up_allowed": false,
    "follow_up_requires_owner_confirmation": true
  },
  "prev_entry_hash": "dddddddddddddddddddddddddddddddddddddddddddddddddddddddddddddddd",
  "execution_class": "AUTO",
  "produced_by": "worker-dry-run-preview",
  "parent_task_id": null,
  "role": "single_worker_preview",
  "dry_run_id": "dryrun-phase3-001",
  "task_id": "task-phase3-001",
  "decision_id": "decision-phase3-001",
  "task_title": "Read synthetic adapter status",
  "task_summary": "A harmless local-only query preview.",
  "proposed_worker_action": "Prepare a mock command envelope without dispatch.",
  "dry_run_status": "preview_only_not_executed",
  "preview_only": true,
  "permissions": {
    "execution_permission": false,
    "dispatch_permission": false,
    "external_side_effects_permission": false,
    "result_persistence_permission": false,
    "audit_trail_write_permission": false
  },
  "runtime_state": {
    "worker_started": false,
    "worker_loop_started": false,
    "task_executed": false,
    "openclaw_called": false,
    "hermes_called": false,
    "google_sheets_enabled": false,
    "real_queue_db_read": false,
    "queue_written": false,
    "post_enabled": false,
    "secrets_read": false,
    "webhook_created": false,
    "endpoint_created": false,
    "connector_created": false,
    "production_db_created": false,
    "remote_blackboard_api_runtime_created": false
  },
  "notes": [
    "No Worker runtime is started.",
    "No external side effect occurs."
  ]
}
